{
  "overall_score": 78,
  "skills_score": 82,
  "experience_score": 72,
  "breakdown": {
    "required_skills_matched": [
      "Java",
      "Spring Boot"
    ],
    "missing_skills": [
      "Kubernetes"
    ],
    "candidate_experience_years": 3
  },
  "rationale": "Illustrative output to demonstrate the response schema; not an actual model evaluation."
}
